,question_id,category,l2_category,question,answer,correct,question_en,options,answer_type
1219,931.0,math,geometry,"A surveyor needs to know the distance between points C and B in Figure 2.17. A building obscures the view directly between the two points. Setting up at the end of the building at point A, the surveyor measures the two distances AC and AB, and the interior angle at A. What is the desired distance, CB?<image 1>
 Options: A: Distance CB = 748.50', B: Distance CB = 748.70', C: Distance CB = 748.60', D: Distance CB = 748.40'",D,0.0,"A surveyor needs to know the distance between points C and B in Figure 2.17. A building obscures the view directly between the two points. Setting up at the end of the building at point A, the surveyor measures the two distances AC and AB, and the interior angle at A. What is the desired distance, CB?<image 1>
 "," A: Distance CB = 748.50', B: Distance CB = 748.70', C: Distance CB = 748.60', D: Distance CB = 748.40'",choice
273,93.0,coarse perception,image scene and topic,"What is the overall theme of the image?
 Options: A: Fashion, B: Wildlife, C: Nature, D: Photography",D,0.384615384615385,"What is the overall theme of the image?
 "," A: Fashion, B: Wildlife, C: Nature, D: Photography",choice
1081,336.0,fine-grained perception,recognition,"Does the man have any facial hair?
 Options: A: No, B: Yes, a mustache, C: Yes, a full beard, D: Yes, slight stubble",B,0.0833333333333333,"Does the man have any facial hair?
 "," A: No, B: Yes, a mustache, C: Yes, a full beard, D: Yes, slight stubble",choice
627,1418.0,science & technology,geography & earth science & agriculture,"Which of the following is the magma chamber?
 Options: A: K, B: B, C: C, D: H",B,0.2,"Which of the following is the magma chamber?
 "," A: K, B: B, C: C, D: H",choice
941,1329.0,science & technology,electronics & energy & mechanical eng.,"A man at a point P on the shore of a circular lake of radius 1 mile wants to reach the point Q on the shore diametrically opposite P (Fig. 16-5). He can row 1.5 miles per hour and walk 3 miles per hour. At what angle $\theta $ ($0<\theta < \pi /2$) to the diameter PQ should he row in order to minimize the time required to reach Q? <image 1>
 Options: A: $\theta = \pi /2$, B: $\theta = \pi /3$, C: $\theta = \pi $, D: $\theta = 2\pi $",A,0.1,"A man at a point P on the shore of a circular lake of radius 1 mile wants to reach the point Q on the shore diametrically opposite P (Fig. 16-5). He can row 1.5 miles per hour and walk 3 miles per hour. At what angle $\theta $ ($0<\theta < \pi /2$) to the diameter PQ should he row in order to minimize the time required to reach Q? <image 1>
 "," A: $\theta = \pi /2$, B: $\theta = \pi /3$, C: $\theta = \pi $, D: $\theta = 2\pi $",choice
976,705.0,logical reasoning,code & sequence reasoning,"What is correct Python code to generate the content of the image?
 Options: A: def myfunc():\n x = 300\n def myinnerfunc():\n print(x)\n myinnerfunc()\n\nmyfunc(), B: thisdict = {\n ""brand"": ""Ford"",\n ""model"": ""Mustang"",\n ""year"": 1964\n}\n\nprint(len(thisdict)), C: x = min(5, 10, 25)\ny = max(5, 10, 25)\n\nprint(x)\nprint(y), D: class Person:\n def __init__(self, name, age):\n self.name = name\n self.age = age\n\np1 = Person(""John"", 36)\n\nprint(p1.name)\nprint(p1.age)",A,0.1,"What is correct Python code to generate the content of the image?
 "," A: def myfunc():\n x = 300\n def myinnerfunc():\n print(x)\n myinnerfunc()\n\nmyfunc(), B: thisdict = {\n ""brand"": ""Ford"",\n ""model"": ""Mustang"",\n ""year"": 1964\n}\n\nprint(len(thisdict)), C: x = min(5, 10, 25)\ny = max(5, 10, 25)\n\nprint(x)\nprint(y), D: class Person:\n def __init__(self, name, age):\n self.name = name\n self.age = age\n\np1 = Person(""John"", 36)\n\nprint(p1.name)\nprint(p1.age)",choice
866,766.0,logical reasoning,common reasoning,"If you were to sit on the chair closest to the window, which color would the chair be?
 Options: A: Green, B: Blue, C: Red, D: White",A,0.1,"If you were to sit on the chair closest to the window, which color would the chair be?
 "," A: Green, B: Blue, C: Red, D: White",choice
999,884.0,logical reasoning,diagram reasoning,"The diagram above represents the cycle of the Earth around the Sun, what letter represents Summer Solstice?
 Options: A: D, B: C, C: B, D: A",D,0.1,"The diagram above represents the cycle of the Earth around the Sun, what letter represents Summer Solstice?
 "," A: D, B: C, C: B, D: A",choice
739,538.0,instance reasoning,cross-instance relation reasoning,"Compare the average kinetic energies of the particles in each sample. Which sample has the higher temperature?
 Options: A: sample B, B: sample A, C: neither; the samples have the same temperature, D: nan",A,0.181818181818182,"Compare the average kinetic energies of the particles in each sample. Which sample has the higher temperature?
 "," A: sample B, B: sample A, C: neither; the samples have the same temperature, D: nan",choice
789,379.0,fine-grained perception,recognition,"What is the color of the eye in the mask in the image?
 Options: A: Blue and green, B: Purple and pink, C: Brown and black, D: Yellow and black",D,0.166666666666667,"What is the color of the eye in the mask in the image?
 "," A: Blue and green, B: Purple and pink, C: Brown and black, D: Yellow and black",choice
612,1402.0,science & technology,geography & earth science & agriculture,"Which area on the map shows China?
 Options: A: B, B: C, C: D, D: A",A,0.2,"Which area on the map shows China?
 "," A: B, B: C, C: D, D: A",choice
1076,279.0,fine-grained perception,object counting,"How many people are holding the flag in the street?
 Options: A: 3, B: 2, C: 1, D: Cannot be determined",B,0.0833333333333333,"How many people are holding the flag in the street?
 "," A: 3, B: 2, C: 1, D: Cannot be determined",choice
5,165.0,coarse perception,image style & quality,"What art style is evident in this image?
 Options: A: watercolor, B: photography, C: vector art, D: pencil",C,0.75,"What art style is evident in this image?
 "," A: watercolor, B: photography, C: vector art, D: pencil",choice
1323,1104.0,math,statistical reasoning,"Given the adjacency matrix of a weighted undirected graph as follows, the total weight of its minimum spanning tree is:<image 1>
 Options: A: 22, B: 20, C: 15, D: 8",D,0.0,"Given the adjacency matrix of a weighted undirected graph as follows, the total weight of its minimum spanning tree is:<image 1>
 "," A: 22, B: 20, C: 15, D: 8",choice
1153,86.0,coarse perception,image scene and topic,"What is the most prominent feature in the image?
 Options: A: The skyline, B: The golf course, C: The trees, D: The person",C,0.0769230769230769,"What is the most prominent feature in the image?
 "," A: The skyline, B: The golf course, C: The trees, D: The person",choice
1273,174.0,coarse perception,image style & quality,"Which category does this image belong to?
 Options: A: oil painting, B: sketch, C: digital art, D: photo",A,0.0,"Which category does this image belong to?
 "," A: oil painting, B: sketch, C: digital art, D: photo",choice
899,1092.0,math,numeric commonsense and calculation,"Which operation of fractions is represented by this formula?
 Options: A: Add, B: Subtract, C: Multiply, D: Devide",B,0.1,"Which operation of fractions is represented by this formula?
 "," A: Add, B: Subtract, C: Multiply, D: Devide",choice
1159,767.0,logical reasoning,common reasoning,"In nature, what's the relationship between these two creatures?
 Options: A: Predatory relationships, B: Competitive relationships, C: Parasitic relationships, D: Symbiotic relationship",B,0.0697674418604651,"In nature, what's the relationship between these two creatures?
 "," A: Predatory relationships, B: Competitive relationships, C: Parasitic relationships, D: Symbiotic relationship",choice
711,805.0,logical reasoning,common reasoning,"What will happen next?
 Options: A: the person is gonna fall off the ladder, B: the person is gonna stand still on the ladder, C: someone is gonna come and hold the ladder, D: both A,B, and C",A,0.181818181818182,"What will happen next?
 "," A: the person is gonna fall off the ladder, B: the person is gonna stand still on the ladder, C: someone is gonna come and hold the ladder, D: both A,B, and C",choice
697,1208.0,science & technology,biology & chemistry & physics,"In the diagram of the food web shown, what do flat fish eat as food?
 Options: A: fan worm, B: nurse shark, C: giant clam, D: turtle grass",B,0.2,"In the diagram of the food web shown, what do flat fish eat as food?
 "," A: fan worm, B: nurse shark, C: giant clam, D: turtle grass",choice
500,527.0,instance reasoning,cross-instance attribute reasoning,"Which picture depicts cell division?
 Options: A: B, B: A, C: C, D: {}",C,0.272727272727273,"Which picture depicts cell division?
 "," A: B, B: A, C: C, D: {}",choice
576,38.0,coarse perception,image scene and topic,"What is the color of the majority of objects in the image?
 Options: A: White, B: Gray, C: Blue, D: Green",A,0.230769230769231,"What is the color of the majority of objects in the image?
 "," A: White, B: Gray, C: Blue, D: Green",choice
271,19.0,coarse perception,image emotion,"Which mood does this image convey?
 Options: A: Sad, B: Cozy, C: Happy, D: Angry",B,0.384615384615385,"Which mood does this image convey?
 "," A: Sad, B: Cozy, C: Happy, D: Angry",choice
498,519.0,instance reasoning,cross-instance attribute reasoning,"Which of the following statements match the image?
 Options: A: A triangle is to the left of a pentagon., B: A blue pentagon is to the right of a gray pentagon., C: A blue square is to the left of a blue pentagon., D: A blue pentagon is to the left of a gray shape.",B,0.272727272727273,"Which of the following statements match the image?
 "," A: A triangle is to the left of a pentagon., B: A blue pentagon is to the right of a gray pentagon., C: A blue square is to the left of a blue pentagon., D: A blue pentagon is to the left of a gray shape.",choice
871,1209.0,science & technology,biology & chemistry & physics,"In the diagram of the food web shown, what will most directly be impacted if the supply of deer increase?
 Options: A: foxes will decrease, B: fruit trees will decrease, C: fruit trees will increase, D: grass will decrease",B,0.1,"In the diagram of the food web shown, what will most directly be impacted if the supply of deer increase?
 "," A: foxes will decrease, B: fruit trees will decrease, C: fruit trees will increase, D: grass will decrease",choice
533,246.0,fine-grained perception,object counting,"How many apples are there in the image? And how many bananas are there?
 Options: A: 3 apples and 1 bananas, B: 3 apples and 2 bananas, C: 1 apples and 1 bananas, D: 2 apples and 1 bananas",C,0.25,"How many apples are there in the image? And how many bananas are there?
 "," A: 3 apples and 1 bananas, B: 3 apples and 2 bananas, C: 1 apples and 1 bananas, D: 2 apples and 1 bananas",choice
1111,123.0,coarse perception,image scene and topic,"What kind of weather is depicted in the picture?
 Options: A: sunny, B: rainy, C: windy, D: snowy",A,0.0833333333333333,"What kind of weather is depicted in the picture?
 "," A: sunny, B: rainy, C: windy, D: snowy",choice
843,56.0,coarse perception,image scene and topic,"What is the main color of the image?
 Options: A: Red, B: Green, C: Black, D: White",D,0.153846153846154,"What is the main color of the image?
 "," A: Red, B: Green, C: Black, D: White",choice
303,653.0,instance reasoning,single-instance reasoning,"What's the profession of the people in this picture?
 Options: A: mason, B: postman, C: pilot, D: policeman",B,0.363636363636364,"What's the profession of the people in this picture?
 "," A: mason, B: postman, C: pilot, D: policeman",choice
1151,94.0,coarse perception,image scene and topic,"What is the overall theme of this image?
 Options: A: Sports, B: Sunset, C: Nature, D: Kids playing",B,0.0769230769230769,"What is the overall theme of this image?
 "," A: Sports, B: Sunset, C: Nature, D: Kids playing",choice
317,373.0,fine-grained perception,recognition,"What is the color of the ball closest to the man?
 Options: A: White, B: Red, C: Blue, D: Brown",A,0.333333333333333,"What is the color of the ball closest to the man?
 "," A: White, B: Red, C: Blue, D: Brown",choice
1275,33.0,coarse perception,image scene and topic,"What color dominates the logo seen on the wall?
 Options: A: Red, B: Black and White, C: Yellow, D: Blue",A,0.0,"What color dominates the logo seen on the wall?
 "," A: Red, B: Black and White, C: Yellow, D: Blue",choice
1303,1181.0,science & technology,biology & chemistry & physics,"<image 1> What could be the reason for the corky outgrowths on a young ash tree by the roadside in Littondale, Yorkshire?
 Options: A: Fungal disease, B: Bacterial disease, C: Don't know or not sure, D: Genetic abnormality",B,0.0,"<image 1> What could be the reason for the corky outgrowths on a young ash tree by the roadside in Littondale, Yorkshire?
 "," A: Fungal disease, B: Bacterial disease, C: Don't know or not sure, D: Genetic abnormality",choice
844,92.0,coarse perception,image scene and topic,"What is the overall theme of the image?
 Options: A: Beach vacation, B: Athletic lifestyle, C: Summer fashion, D: Urban street style",C,0.153846153846154,"What is the overall theme of the image?
 "," A: Beach vacation, B: Athletic lifestyle, C: Summer fashion, D: Urban street style",choice
558,378.0,fine-grained perception,recognition,"What is the color of the ears on the dessert item located in the bottom right of the image?
 Options: A: Red, B: Brown, C: Black, D: White",D,0.25,"What is the color of the ears on the dessert item located in the bottom right of the image?
 "," A: Red, B: Brown, C: Black, D: White",choice
812,410.0,fine-grained perception,recognition,"What is the main item on the counter in the image?
 Options: A: A cup of ice cream on a counter with a cone on top, B: Two ice cream cones sitting next to each other, C: A coffee cup with whipped cream on top, D: A cup of ice cream with different flavors",B,0.166666666666667,"What is the main item on the counter in the image?
 "," A: A cup of ice cream on a counter with a cone on top, B: Two ice cream cones sitting next to each other, C: A coffee cup with whipped cream on top, D: A cup of ice cream with different flavors",choice
709,814.0,logical reasoning,common reasoning,"Which corner doesn't have any food?
 Options: A: top-right, B: top-left, C: bottom-left, D: bottom-right",D,0.181818181818182,"Which corner doesn't have any food?
 "," A: top-right, B: top-left, C: bottom-left, D: bottom-right",choice
1084,55.0,coarse perception,image scene and topic,"What is the main activity happening in this image?
 Options: A: A couple of men are playing soccer, B: A group of people are having a picnic in the park, C: Two men are playing cricket, D: A group of people are playing volleyball",A,0.0833333333333333,"What is the main activity happening in this image?
 "," A: A couple of men are playing soccer, B: A group of people are having a picnic in the park, C: Two men are playing cricket, D: A group of people are playing volleyball",choice
