qid,category,l2_category,question_en,options,answer_type,question_kr
147,coarse perception,image scene and topic,"Which of the following captions best describes this image?
 ","A: A group of people sitting around a campfire 모닥불 주위에 앉아 있는 사람들, B: A person kayaking on a lake 호수에서 카약을 타는 사람, C: A family having a picnic in a park 공원에서 피크닉을 즐기는 가족, D: A person hiking on a mountain trail 산길에서 하이킹하는 사람",choice,다음 중 이 이미지를 가장 잘 설명하는 캡션은 무엇입니까?
397,fine-grained perception,recognition,"What is the color of the watch worn by a person in the image?
 ","A: White, B: Black, C: Silver, D: Gold A: 흰색, B: 검정색, C: 은색, D: 금색",choice,이미지 속 사람의 시계 색상은 무엇입니까?
360,fine-grained perception,recognition,"What color is the microphone in the image?
 "," A: Silver 은색, B: White 흰색, C: Black 검은색, D: Red 빨간색",choice,이미지 속 마이크의 색상은 무엇입니까?
315,fine-grained perception,object counting,"How many tables are there in the room?
 ","A: Four tables 네 개의 탁자, B: Two tables 두 개의 탁자, C: Three tables 세 개의 탁자, D: One table 한 개의 탁자",choice,방에 탁자가 몇 개 있나요?
307,fine-grained perception,object counting,"How many pillows can be seen in the bedroom?
 ","A: 5 5개, B: 4 4개, C: 3 3개, D: 6 6개",choice,침실에서 보이는 베개는 몇 개입니까?
260,fine-grained perception,object counting,"How many colors are the eyes of the depicted animals?
 ","  A: Two 두 가지, B: One 한 가지, C: Three 세 가지, D: Four 네 가지",choice,그려진 동물들의 눈은 몇 가지 색인가요?
431,fine-grained perception,recognition,"What type of ball is being held by the player?
 ","A: A tennis ball 테니스 공, B: A basketball 농구공, C: A volleyball 배구공, D: A soccer ball 축구공",choice,선수가 들고 있는 공의 종류는 무엇입니까?
212,fine-grained perception,localization,"What is the position of the person on stage?
 ","A: Standing on the left side 왼쪽에 서 있는 사람, B: Seated in the center 가운데에 앉아 있는 사람, C: Sitting on the floor in front 앞쪽 바닥에 앉아 있는 사람, D: Leaning on the guitar on the right side 오른쪽 편의 기타에 기대고 있는 사람",choice,무대 위에 있는 사람의 위치는 어디인가요?
219,fine-grained perception,localization,"Where is it?
 ","A: Shanghai 상하이, B: Xi'an 시안, C: Wuhan 우한, D: Nanjing 난징",choice,그것은 어디에 있나요?
386,fine-grained perception,recognition,"What is the color of the number on the red and blue jersey in the image?
 ","A: Blue 파란색, B: Red 빨간색, C: Orange 주황색, D: Black 검은색",choice,이미지 속 빨간색과 파란색 저지에 있는 숫자의 색상은 무엇입니까?
330,fine-grained perception,object counting,"How many wooden objects are in the image?
 ","A: 1, B: 2, C: 3, D: 4 A: 일, B: 이, C: 삼, D: 사",choice,이미지에 나무로 된 물체가 몇 개 있나요?
319,fine-grained perception,object counting,"How many tires can be seen in the image?
 ","A: 4 4개, B: 3 3개, C: 5 5개, D: 6 6개",choice,이미지에서 보이는 타이어의 개수는 몇 개입니까?
447,fine-grained perception,recognition,"Who is the person in this image?
 ","A: Kobe Bryant 코비 브라이언트, B: Jing Wu 징 우, C: Morgan Freeman 모건 프리먼, D: Jay Chou 제이 추",choice,이 이미지 속 인물은 누구입니까?
442,fine-grained perception,recognition,"Which scene category matches this image the best?
 ","A: forest_path 숲길, B: museum/indoor 박물관/실내, C: storage_room 저장실, D: alley 골목",choice,이 이미지에 가장 잘 맞는 장면 카테고리는 무엇입니까?
383,fine-grained perception,recognition,"What is the color of the lettering on the green sign in the image?
 ","A: Black 검은색, B: Blue 파란색, C: Yellow 노란색, D: White 흰색",choice,이미지의 초록색 표지판에 적힌 글자의 색은 무엇입니까?
375,fine-grained perception,recognition,"What is the color of the couch in the image?
 ","A: Beige 베이지색, B: Brown 갈색, C: Tan 탠색, D: Gray 회색",choice,이미지 속 소파의 색은 무엇입니까?
292,fine-grained perception,object counting,"How many people are present in the image?
 ","A: One 하나, B: Three 세, C: Two 두, D: Four 네",choice,이미지에 몇 명의 사람이 있나요?
401,fine-grained perception,recognition,"What is the color scheme of the costumes worn by the men in the parade?
 ","A: Yellow, red, and gold 노란색, 빨간색, 금색, B: Red, blue, and black 빨간색, 파란색, 검은색, C: Green, orange, and white 초록색, 주황색, 흰색, D: Black, white, and gray 검은색, 흰색, 회색",choice,행진에 참가한 남성들이 입은 의상의 색상 구성은 무엇입니까?
295,fine-grained perception,object counting,"How many people are standing on the stage in the image?
 ","A: One 한 명, B: More than three 네 명 이상, C: Three 세 명, D: Two 두 명",choice,이미지 속 무대 위에 몇 사람이 서 있습니까?
493,instance reasoning,cross-instance attribute reasoning,"What is the relative position of the man and woman in the image?
 ","A: They are facing each other 그들은 서로 마주 보고 있다, B: They are both facing forward 그들은 모두 앞으로 향해 있다, C: They are both facing the camera 그들은 모두 카메라를 향하고 있다, D: They are both looking away from the camera 그들은 모두 카메라를 등지고 있다",choice,이미지 속 남자와 여자의 상대 위치는 무엇입니까?
819,logical reasoning,diagram reasoning,"<image 1> is the HRM Roles, David Ulrich (1997) model. According to Ulrich, if HR is to become and remain relevant in the current business environment, what is not something HR professionals must learn?
 ","A: Manage human resources operations and infrastructure 인적 자원 운영 및 인프라 관리, B: Become the link between human resources and organizational strategy 인적 자원과 조직 전략 사이의 연결고리가 된다, C: Optimize the value of employees 직원의 가치를 최적화하다, D: Be a change agent with a long-term vision for the organization 조직에 대한 장기 비전을 가진 변화 주도자가 된다",choice,"질문: David Ulrich(1997)의 HRM 역할 모델에 따르면, HR이 현재의 비즈니스 환경에서 관련성을 유지하고 유지하려면 HR 전문가가 배워야 할 것이 아닌 것은 무엇입니까?"
919,logical reasoning,diagram reasoning,"Which month has the lowest average precipitation in London?
 ","A: July 7월, B: February 2월, C: November 11월, D: nan 없음",choice,런던에서 평균 강수량이 가장 낮은 달은 무엇입니까?
609,instance reasoning,single-instance reasoning,"What is the dominant material of the cabinets in the image?
 ","A: Ceramic 도자기, B: Metal 금속, C: Wood 목재, D: Glass 유리",choice,이미지 속 찬장의 주된 재료는 무엇인가요?
569,instance reasoning,cross-instance relation reasoning,"Which property do these three objects have in common?
 ","A: blue 파란색, B: smooth 매끄러운, C: flexible 유연한, D: nan 숫자가 아님",choice,이 세 물체가 공통으로 가지는 성질은 무엇입니까?
1247,science & technology,biology & chemistry & physics,"What is H in the diagram?
 ","A: pith 피스, B: protoxylem 원시목, C: cambium 형성층, D: metaxylem 메타목",choice,도표에서 H는 무엇입니까?
168,coarse perception,image style & quality,"Which category does this image belong to?
 ","A: MRI image MRI 영상, B: icon 아이콘, C: microscopic image 현미경 이미지, D: abstract painting 추상화",choice,이 이미지는 어떤 범주에 속하나요?
1411,science & technology,geography & earth science & agriculture,"Which label indicates the earth's gravitational pull on the moon?
 ","A: D, B: A, C: B, D: E A: 디, B: 에이, C: 비, D: 이",choice,달에 작용하는 지구의 중력을 가리키는 표시는 무엇입니까?
669,instance reasoning,single-instance reasoning,"Which is right?
 ","A: The orange is next to the apple, 오렌지는 사과 옆에 있다 B: The apple is on the left, 사과는 왼쪽에 있다 C: The orange is on the right, 오렌지는 오른쪽에 있다 D: All above are not right, 위의 모든 항목은 옳지 않다",choice,다음 중 옳은 것은 무엇입니까?
1214,science & technology,biology & chemistry & physics,"Leaf B is of which plant?
 ","A: Celtis, B: Stem, C: Ulmus, D: Lotus  A: 셀티스, B: 줄기, C: 느릅나무, D: 연꽃",choice,잎 B는 어느 식물의 잎인가요?
1215,science & technology,biology & chemistry & physics,"Letter A in the following diagram represents which stage?
 ","A: attached planula 부착된 플라눌라, B: polyp 폴립, C: ephyra 에피라, D: planula 플라눌라",choice,다음 다이어그램에서 문자 A가 나타내는 단계는 무엇입니까?
248,fine-grained perception,object counting,"How many archways are there in the image?
 ","A: One 하나, B: Four 네, C: Three 세, D: Two 두",choice,이미지 속 아치의 수는 몇 개인가요?
395,fine-grained perception,recognition,"What is the color of the socks detected in the attribute detection of the image?
 ","A: Black 검정, B: Red 빨간색, C: White 흰색, D: Striped 줄무늬",choice,이미지의 속성 탐지에서 탐지된 양말의 색은 무엇입니까?
882,logical reasoning,diagram reasoning,"In the diagram shown, which organism consumes small fish as food?
 "," A: mahi mahi 마히마히, B: large shark 큰상어, C: zooplankton 동물성 플랑크톤, D: mackerel 고등어",choice,제시된 도표에서 작은 물고기를 먹이로 삼는 생물은 무엇입니까?
1327,science & technology,electronics & energy & mechanical eng.,"<image 1>The accompanying sketch shows the schematic arrangement for measuring the thermal conductivity by the guarded hot plate method. Two similar 1 cm thick specimens receive heat from a 6.5 cm by 6.5 cm guard heater. When the power dissipation by the wattmeter was 15 W, the thermocouples inserted at the hot and cold surfaces indicated temperatures as 325 K and 300 K. What is the thermal conductivity of the test specimen material?
 ","A: 0.81 W/m K 0.81 W/m K, B: 0.71 W/m K 0.71 W/m K, C: 0.61 W/m K 0.61 W/m K, D: 0.51 W/m K 0.51 W/m K",choice,"첨부된 도면은 guarded hot plate 방법으로 열전도율을 측정하기 위한 개략적 배열을 보여준다. 두께가 1 cm인 두 유사한 시편이 6.5 cm × 6.5 cm의 가드 히터로부터 열을 받는다. 와트미터의 전력 소모가 15 W일 때, 핫 표면과 냉 표면에 삽입된 열전쌍은 각각 325 K와 300 K의 온도를 나타냈다. 시험 시편 재료의 열전도율은 얼마인가?"
221,fine-grained perception,localization,"Where is the drum located in the image?
 ","A: In the back 뒤쪽에, B: On the left side 왼쪽에, C: On the right side 오른쪽에, D: At the center 중앙에",choice,이미지 속 드럼은 어디에 위치해 있나요?
1367,science & technology,electronics & energy & mechanical eng.,"Which schedule is an equivalent serial schedule for the precendence graph in <image 1>?
 ","A: T3 -> T1 -> T2  (한국어: A: T3 -> T1 -> T2), B: T2 -> T1 -> T3  (한국어: B: T2 -> T1 -> T3), C: T1 -> T2 -> T3  (한국어: C: T1 -> T2 -> T3), D: There are no serial schedules for the graph.  (한국어: 그래프에 대한 직렬 일정이 없다.)",choice,다음 그림 1의 선행 그래프에 대해 어떤 직렬 일정이 동등한가?
711,logical reasoning,code & sequence reasoning,"Which Python code can generate the content of the image?
 ","A: from collections import Counter
 result = Counter('Canada')
 print(result)  'Canada' 문자열에 대해 Counter를 생성하고 그 결과를 출력합니다., B: from collections import Counter
 result = Counter('strawberry')
 print(result)  'strawberry' 문자열에 대해 Counter를 생성하고 그 결과를 출력합니다., C: from collections import Counter
 result = Counter('banana')
 print(result)  'banana' 문자열에 대해 Counter를 생성하고 그 결과를 출력합니다., D: from collections import Counter
 result = Counter('apple')
 print(result)  'apple' 문자열에 대해 Counter를 생성하고 그 결과를 출력합니다.",choice,이미지의 내용을 생성할 수 있는 파이썬 코드는 무엇입니까?
54,coarse perception,image scene and topic,"What is the general theme of this image?
 ","A: Candy buffet 캔디 뷔페, B: Ice cream sundae 아이스크림 선데, C: Yogurt containers 요거트 용기, D: Fruit desserts 과일 디저트",choice,이 이미지의 일반적인 주제는 무엇입니까?
551,instance reasoning,cross-instance relation reasoning,"What can Rosa and Kylie trade to each get what they want?
 ",A: Kylie can trade her almonds for Rosa's tomatoes. 카일리는 자신의 아몬드를 로사의 토마토와 바꿀 수 있다. B: Rosa can trade her tomatoes for Kylie's broccoli. 로사는 자신의 토마토를 카일리의 브로콜리와 바꿀 수 있다. C: Rosa can trade her tomatoes for Kylie's carrots. 로사는 자신의 토마토를 카일리의 당근과 바꿀 수 있다. D: Kylie can trade her broccoli for Rosa's oranges. 카일리는 자신의 브로콜리를 로사의 오렌지와 바꿀 수 있다.,choice,로사와 카일리는 서로 원하는 것을 얻기 위해 무엇을 교환할 수 있을까요?
1178,math,statistical reasoning,"You are asked to compare two options with parameters as given. The risk-free interest rate should be assumed to be 6%. Assume the stocks on which these options are written pay no dividends. <image 1> Which put option must be written on the stock with the lower price?
 ","A: A (영어 옵션 A), B: B (영어 옵션 B), C: Not enough information (한국어: 충분한 정보가 없음), D: nan (한국어: 숫자가 아님)",choice,주어진 매개변수로 두 옵션을 비교하라는 요청을 받았습니다. 무위험 이자율은 6%로 가정합니다. 이 옵션들이 기초하는 주식은 배당금을 지급하지 않는다고 가정합니다. <image 1> 가격이 더 낮은 주식에 대해 어떤 풋옵션을 매도해야 합니까?
504,instance reasoning,cross-instance attribute reasoning,"Where is the top of the purple bottle in relation to the man with the guitar?
 ","A: Beside him 그 옆에 있습니다, B: Above him 그 위에 있습니다, C: Below him 그 아래에 있습니다, D: On his head 그의 머리 위에 있습니다",choice,기타를 든 남자에 비해 보라색 병의 윗부분은 어디에 위치합니까?
913,logical reasoning,diagram reasoning,"Which country is highlighted?
 ","A: Saint Lucia 세인트 루시아, B: Jamaica 자메이카, C: Haiti 아이티, D: Cuba 쿠바",choice,어떤 나라가 강조되었나요?
1196,science & technology,biology & chemistry & physics,"From the above food web diagram, if all th bettle dies then
 ","A: guava increases 구아바가 증가한다, B: fungi decreases 곰팡이가 감소한다, C: bacteria increases 박테리아가 증가한다, D: guava decreases 구아바가 감소한다",choice,위의 먹이망 다이어그램에서 모든 딱정벌레가 죽는다면
1230,science & technology,biology & chemistry & physics,"The manufacture of compound F requires five separate chemical reactions. The initial reactant, compound A, is converted to compound B, compound B is converted to compound C, and so on. The diagram below summarizes the steps in the manufacture of compound F, including the percent yield for each step. Provide the missing quantities or missing percent yields.Assume that the reactant and product in each step react in a one-to-one mole ratio. <image 1>
 "," A: 20.0%,0.50 mol,0.05 mol,20.0% A: 20.0%,0.50 몰,0.05 몰,20.0%, B: 30.0%,0.50 mol,0.05 mol,20.0% B: 30.0%,0.50 몰,0.05 몰,20.0%, C: 40.0%,0.50 mol,0.05 mol,20.0% C: 40.0%,0.50 몰,0.05 몰,20.0%, D: 50.0%,0.50 mol,0.05 mol,20.0% D: 50.0%,0.50 몰,0.05 몰,20.0%",choice,"화합물 F의 제조에는 다섯 개의 독립적인 화학 반응이 필요합니다. 초기 반응물인 화합물 A는 화합물 B로 변환되고, 화합물 B는 화합물 C로 변환되며, 이와 같이 계속되어 화합물 F의 제조가 이루어집니다. 아래 도표는 각 단계의 수율을 포함하여 화합물 F의 제조 과정을 요약합니다. 누락된 양 또는 누락된 수율을 구하십시오. 각 단계에서 반응물과 생성물이 1:1 몰 비로 반응한다고 가정합니다. <image 1>"
651,instance reasoning,single-instance reasoning,"What's the profession of the people in this picture?
 ","A: mason 석공, B: nurse 간호사, C: pilot 조종사, D: policeman 경찰관",choice,이 사진 속 사람들의 직업은 무엇인가요?
1312,science & technology,biology & chemistry & physics,"Which picture represents Aculeate?
 ","A: G, B: F, C: C, D: N A: G, B: F, C: C, D: N",choice,Aculeate를 나타내는 그림은 어떤 그림입니까?
801,logical reasoning,common reasoning,"What will happen next?
 ","A: the girls is gonna turn the pan around, 그 소녀들은 팬을 돌려 방향을 바꿀 것이다, B: the pan itself is gonna fly into the woman's face, 팬 자체가 여자의 얼굴로 날아갈 것이다, C: nothing is gonna happen, 아무 일도 일어나지 않을 것이다, D: both A,B, and C, A,B, 그리고 C 모두",choice,다음에 무슨 일이 일어날까요?
1257,science & technology,biology & chemistry & physics,"What is the ATP in the diagram?
 ","A: B 비, B: A 에이, C: D 디, D: none of the above 위의 보기 중 해당 없음",choice,도표의 ATP는 무엇입니까?
626,instance reasoning,single-instance reasoning,"What's the function of the demonstrated object?
 ","A: clean 청소, B: measurement 측정, C: Bulldozing 불도저 작업, D: Cutting platform 절단 플랫폼",choice,시연된 물체의 기능은 무엇입니까?
370,fine-grained perception,recognition,"What color is the writing on the sign in the image?
 ","A: White 흰색, B: Green 초록색, C: Red 빨간색, D: Black 검은색",choice,이미지 속 간판에 적힌 글씨의 색은 무엇입니까?
1175,math,statistical reasoning,"The Booth Company's sales are forecasted to double from $1,000 in 2010 to $2,000 in 2011. Here is the December 31, 2010, balance sheet: <image 1> Booth's fixed assets were used to only 50% of capacity during 2010, but its current assets were at their proper levels in relation to sales. All assets except fixed assets must increase at the same rate as sales, and fixed assets would also have to increase at the same rate if the current excess capacity did not exist. Booth's after-tax profit margin is forecasted to be 5% and its payout ratio to be 60%. What is Booth's additional funds needed (AFN) for the coming year?
 ","A: 360 삼백육십, B: Other Answers 다른 답변, C: nan 숫자 아님, D: nan 숫자 아님",choice,"Booth Company의 매출은 2010년 1,000달러에서 2011년 2,000달러로 두 배로 증가할 것으로 예측된다. 아래에는 2010년 12월 31일의 대차대조표가 있다: <image 1> Booth의 고정자산은 2010년 동안 설비 용량의 50%만 사용되었지만, 유동자산은 매출에 비례하여 적정 수준이 있었다. 고정자산을 제외한 모든 자산은 매출 증가율과 같은 비율로 증가해야 하며, 현재의 여유 용량이 존재하지 않는다면 고정자산 역시 같은 비율로 증가해야 한다. Booth의 세후 이익률은 5%로, 배당성향은 60%로 예측된다. 다가오는 해에 Booth가 필요한 추가 자금(AFN)은 얼마인가?"
1270,science & technology,biology & chemistry & physics,"What stage does D depict
 ","A: Chrysalis 고치, B: Egg 알, C: Caterpillar 애벌레, D: Butterfly 나비",choice,D가 묘사하는 단계는 무엇입니까?
1332,science & technology,electronics & energy & mechanical eng.,"Among the following binary trees, which one may become a binary search decision tree (excluding external nodes)
 ","A: <image 1>, B: <image 2>, C: <image 3>, D: <image 4> A: 이미지 1, B: 이미지 2, C: 이미지 3, D: 이미지 4",choice,다음 이진 트리들 중에서 어떤 것이 외부 노드를 제외한 이진 검색 결정 트리로 될 수 있는가?
425,fine-grained perception,recognition,"What is the shape of the window on the building in the image?
 ","A: Square 정사각형, B: Rectangle 직사각형, C: Circle 원, D: Triangle 삼각형",choice,이미지 속 건물의 창문 모양은 무엇인가요?
543,instance reasoning,cross-instance relation reasoning,"In nature, what's the relationship between these two creatures?
 ","A: Predatory relationships 포식적 관계, B: Competitive relationships 경쟁적 관계, C: Parasitic relationships 기생 관계, D: Symbiotic relationship 공생 관계",choice,자연에서 이 두 생물 사이의 관계는 무엇입니까?
663,instance reasoning,single-instance reasoning,"Where is the sheep?
 ","A: The sheep is behind the car 양은 차 뒤에 있다, B: The sheep is in the front of the car 양은 차 앞에 있다, C: The sheep is on the right of the car 양은 차의 오른쪽에 있다, D: The sheep is on the left of the car 양은 차의 왼쪽에 있다",choice,양은 어디에 있나요?
181,coarse perception,image style & quality,"Which image is more brightful?
 ","A: The first image 첫 번째 이미지, B: The second image 두 번째 이미지, C: nan, D: nan",choice,어떤 이미지가 더 밝습니까?
510,instance reasoning,cross-instance attribute reasoning,"Which image shows the highest sharpness?
 ","A: upper left 왼쪽 상단, B: upper right 오른쪽 상단, C: down left 왼쪽 하단, D: down right 오른쪽 하단",choice,어떤 이미지가 가장 선명합니까?
511,instance reasoning,cross-instance attribute reasoning,"Which image shows the highest sharpness?
 ","A: upper left 왼쪽 위, B: upper right 오른쪽 위, C: down left 왼쪽 아래, D: down right 오른쪽 아래",choice,가장 선명한 이미지는 어느 것인가?
278,fine-grained perception,object counting,"How many pairs of shoes can be seen in the image?
 ","A: One 하나, B: Three 세, C: Two 두, D: Cannot be determined 판단할 수 없다",choice,이미지에서 보이는 신발의 쌍은 몇 개입니까?
24,coarse perception,image scene and topic,"Based on the image, which statement best describes the likely purpose of the setting?
 ","A: A photoshoot for greeting cards 인사 카드용 사진 촬영, B: A scientific research site 과학 연구 현장, C: A festive celebration 축제적인 축하 행사, D: A picnic spot for a group of people 여러 명이 함께하는 피크닉 장소",choice,이미지를 기반으로 볼 때 이 설정의 가능한 목적을 가장 잘 설명하는 진술은 무엇입니까?
245,fine-grained perception,object counting,"How many angels have halos?
 ","A: Two 두 명, B: One 한 명, C: nan 숫자가 아님, D: Three 세 명",choice,후광을 가진 천사는 몇 명입니까?
655,instance reasoning,single-instance reasoning,"What's the profession of the people in this picture?
 ","A: photographer 사진작가, B: chemist 화학자, C: repairman 수리공, D: pianist 피아니스트",choice,이 사진 속 사람들의 직업은 무엇입니까?
231,fine-grained perception,localization,"Where is the table in relation to the balcony?
 ","A: On the right side of the balcony, 발코니의 오른쪽에, B: In the center of the balcony, 발코니의 중앙에, C: On the left side of the balcony, 발코니의 왼쪽에, D: Cannot be determined from the information given, 주어진 정보로는 판단할 수 없다",choice,탁자는 발코니에 대해 어느 위치에 있나요?
1194,science & technology,biology & chemistry & physics,"Consider the molecule in blue bound to a binding site. Identify the binding interactions taking place at ii shown in red. <image 1>
 ","A: hydrogen bonds A: 수소 결합, B: ionic bonds B: 이온 결합, C: van der Waals interactions C: 반데르발스 상호작용, D: nan D: 없음",choice,파란색으로 표시된 분자가 결합 부위에 결합해 있다. 빨간색으로 표시된 ii 위치에서 일어나는 결합 상호작용을 식별하시오. <image 1>
629,instance reasoning,single-instance reasoning,"What's the function of the demonstrated object?
 ","A: excavate 굴착하다, B: transport 운반하다, C: weld 용접하다, D: Measure the level 수준을 측정하다",choice,시연된 물체의 기능은 무엇입니까?
215,fine-grained perception,localization,"What is the position of the sheep's legs in the image?
 ",A: At the top 위쪽에 B: On the right side 오른쪽에 C: On the left side 왼쪽에 D: At the bottom 아래쪽에,choice,이미지에서 양의 다리는 어디에 있나요?
924,logical reasoning,diagram reasoning,"Which solution has a higher concentration of green particles?
 ","A: neither; their concentrations are the same 둘 다 아니다; 농도는 같다, B: Solution A 용액 A, C: Solution B 용액 B, D: nan 숫자가 아니다",choice,어떤 용액에서 녹색 입자의 농도가 더 높은가요?
441,fine-grained perception,recognition,"Which of these cities is marked on the map?
 ","A: New York City 뉴욕시, B: Washington, D.C. 워싱턴 D.C., C: Philadelphia 필라델피아, D: Boston 보스턴",choice,다음 도시들 중 지도에 표시된 도시는 어느 도시입니까?
