qid,category,l2_category,question_en,options,answer_type,question_kr
1403,science & technology,geography & earth science & agriculture,"Which country is highlighted?
 ","A: Dominica 도미니카, B: Antigua and Barbuda 앤티가 바부다, C: Barbados 바베도스, D: Saint Kitts and Nevis 세인트키츠 네비스",choice,어느 나라가 강조 표시되어 있나요?
1374,science & technology,geography & earth science & agriculture,"What does D depict in the diagram?
 ","A: 4th quarter 4분기, B: 1st quarter 1분기, C: 3rd quarter 3분기, D: none of the above 위의 어느 것도 아니다",choice,도표에서 D가 나타내는 것은 무엇입니까?
494,instance reasoning,cross-instance attribute reasoning,"What is the relative position of the man holding a guitar and the woman on stage?
 ","A: The man is behind the woman 남자는 여자 뒤에 있다, B: The man is to the right of the woman 남자는 여자의 오른쪽에 있다, C: The man is to the left of the woman 남자는 여자의 왼쪽에 있다, D: The man is in front of the woman 남자는 여자 앞에 있다",choice,무대 위에 있는 여자와 기타를 들고 있는 남자의 상대적인 위치는 무엇입니까?
1376,science & technology,geography & earth science & agriculture,"What does letter E depict?
 ","A: waning gibbous 하현보름달, B: first quarter 상현달, C: waxing gibbous 상현보름달, D: last quarter 하현달",choice,문자 E는 무엇을 나타냅니까?
46,coarse perception,image scene and topic,"What is the dominant color of the image?
 ","A: White 흰색, B: Brown 갈색, C: Gray 회색, D: Green 초록",choice,이미지의 주된 색상은 무엇인가요?
287,fine-grained perception,object counting,"How many people are playing music in the image?
 ","A: One, B: Two, C: Three, D: Four A: 한 명, B: 두 명, C: 세 명, D: 네 명",choice,이미지에서 음악을 연주하고 있는 사람은 몇 명인가요?
239,fine-grained perception,localization,"where is the cat?
 "," A: top-right 오른쪽 상단, B: top-left 왼쪽 상단, C: bottom-left 왼쪽 하단, D: bottom-right 오른쪽 하단",choice,고양이가 어디에 있나요?
1263,science & technology,biology & chemistry & physics,"What is the probability that a sheep produced by this cross will be homozygous dominant for the wool color gene?
 ","A: 2/4 4분의 2, B: 1/4 4분의 1, C: 0/4 4분의 0, D: 3/4 4분의 3",choice,이 교배로 생산된 양이 양모 색 유전자에 대해 동형접합 우성일 확률은 얼마입니까?
3,coarse perception,image emotion,"What feeling is represented in this image?
 ","A: engaged 몰입한, B: disordered 무질서한, C: angry 화난, D: supportive 지지하는",choice,이 이미지에서 표현된 감정은 무엇인가요?
1278,science & technology,biology & chemistry & physics,"Where do the axons of this nucleus terminate? <image 1> 
 ","A: Muscles of pharynx and larynx. 인두와 후두의 근육들., B: Postganglionic parasympathetic cell bodies. 부교감 신경절의 신경세포체들., C: Smooth muscle of viscera. 내장기관의 평활근., D: nan. 숫자가 아님",choice,이 핵의 축삭은 어디에서 종결합니까? <image 1>
931,math,geometry,"A surveyor needs to know the distance between points C and B in Figure 2.17. A building obscures the view directly between the two points. Setting up at the end of the building at point A, the surveyor measures the two distances AC and AB, and the interior angle at A. What is the desired distance, CB?<image 1>
 ",A: Distance CB = 748.50' C와 B 사이의 거리 = 748.50' B: Distance CB = 748.70' C와 B 사이의 거리 = 748.70' C: Distance CB = 748.60' C와 B 사이의 거리 = 748.60' D: Distance CB = 748.40' C와 B 사이의 거리 = 748.40',choice,"측량사는 그림 2.17에서 점 C와 점 B 사이의 거리를 알아야 한다. 건물이 두 점 사이의 시야를 직접 가리므로 차단된다. 건물의 끝에 있는 A 지점에 설치하고, 측량사는 AC와 AB 두 거리와 A에서의 내각을 측정한다. 원하는 거리 CB는 얼마인가?"
93,coarse perception,image scene and topic,"What is the overall theme of the image?
 ","A: Fashion 패션, B: Wildlife 야생동물, C: Nature 자연, D: Photography 사진",choice,그 이미지의 전반적인 주제는 무엇입니까?
336,fine-grained perception,recognition,"Does the man have any facial hair?
 ","A: No, 아니오, B: Yes, a mustache 네, 콧수염이 있습니다, C: Yes, a full beard 네, 전면 수염이 있습니다, D: Yes, slight stubble 네, 약간의 잔털이 있습니다",choice,그 남자에게 얼굴 털이 있나요?
1418,science & technology,geography & earth science & agriculture,"Which of the following is the magma chamber?
 ","A: K 케 이? No, wait. A: K 케 이? correction: A: K 케이, B: B 비, C: C 씨, D: H 에이치",choice,다음 중 마그마 방은 어느 것입니까?
1329,science & technology,electronics & energy & mechanical eng.,"A man at a point P on the shore of a circular lake of radius 1 mile wants to reach the point Q on the shore diametrically opposite P (Fig. 16-5). He can row 1.5 miles per hour and walk 3 miles per hour. At what angle $\theta $ ($0<\theta < \pi /2$) to the diameter PQ should he row in order to minimize the time required to reach Q? <image 1>
 ","A: $\theta = \pi /2$, B: $\theta = \pi /3$, C: $\theta = \pi $, D: $\theta = 2\pi $ A: 세타 = π /2 B: 세타 = π /3 C: 세타 = π D: 세타 = 2π",choice,반지름이 1마일인 원형 호수의 해안에 있는 점 P에서 시작해 P와 직경상 반대편에 위치한 해안의 점 Q에 도달하고 싶다. 그는 시속 1.5마일로 노를 젓고 시속 3마일로 걷는다. Q에 도달하는 데 필요한 시간을 최소화하려면 PQ의 직경에 대해 θ(0<θ<π/2) 만큼의 각도로 노를 저어야 하는가? (그림 16-5)
705,logical reasoning,code & sequence reasoning,"What is correct Python code to generate the content of the image?
 "," A: def myfunc():\n x = 300\n def myinnerfunc():\n print(x)\n myinnerfunc()\n\nmyfunc() (한국어 번역: 이 코드는 x 값을 출력하기 위해 중첩 함수를 정의하고 호출합니다.), B: thisdict = {\n ""brand"": ""Ford"",\n ""model"": ""Mustang"",\n ""year"": 1964\n}\n\nprint(len(thisdict)) (한국어 번역: 이 코드는 딕셔너리를 생성하고 길이를 출력합니다.), C: x = min(5, 10, 25)\ny = max(5, 10, 25)\n\nprint(x)\nprint(y) (한국어 번역: 이 코드는 최소값과 최대값을 계산하고 출력합니다.), D: class Person:\n def __init__(self, name, age):\n self.name = name\n self.age = age\n\np1 = Person(""John"", 36)\n\nprint(p1.name)\nprint(p1.age) (한국어 번역: 이 코드는 이름과 나이를 가진 Person 클래스를 정의하고 인스턴스의 이름과 나이를 출력합니다.)",choice,이미지의 내용을 생성하기 위한 올바른 파이썬 코드는 무엇입니까?
766,logical reasoning,common reasoning,"If you were to sit on the chair closest to the window, which color would the chair be?
 ","A: Green 초록색, B: Blue 파란색, C: Red 빨간색, D: White 흰색",choice,창문에 가장 가까운 의자에 앉는다면 의자는 어떤 색일까요?
884,logical reasoning,diagram reasoning,"The diagram above represents the cycle of the Earth around the Sun, what letter represents Summer Solstice?
 ","A: D 디, B: C 씨, C: B 비, D: A 에이",choice,위의 도표는 지구가 태양 주위를 도는 주기를 나타냅니다. 여름 하지에 해당하는 문자는 무엇입니까?
538,instance reasoning,cross-instance relation reasoning,"Compare the average kinetic energies of the particles in each sample. Which sample has the higher temperature?
 ","A: sample B 샘플 B, B: sample A 샘플 A, C: neither; the samples have the same temperature 어느 쪽도 아니다; 두 샘플은 같은 온도이다, D: nan 숫자가 아님",choice,각 샘플에 포함된 입자들의 평균 운동에너지를 비교하시오. 어느 샘플의 온도가 더 높습니까?
379,fine-grained perception,recognition,"What is the color of the eye in the mask in the image?
 ","A: Blue and green 파란색과 초록색, B: Purple and pink 보라색과 분홍색, C: Brown and black 갈색과 검은색, D: Yellow and black 노란색과 검은색",choice,이미지 속 가면의 눈 색깔은 무엇입니까?
1402,science & technology,geography & earth science & agriculture,"Which area on the map shows China?
 ","A: B 비, B: C 씨, C: D 디, D: A 에이",choice,지도에서 중국이 표시된 영역은 어디인가요?
279,fine-grained perception,object counting,"How many people are holding the flag in the street?
 ","A: 3 삼, B: 2 이, C: 1 일, D: Cannot be determined 알 수 없음",choice,거리에서 깃발을 들고 있는 사람은 몇 명인가요?
165,coarse perception,image style & quality,"What art style is evident in this image?
 ","A: watercolor 수채화, B: photography 사진, C: vector art 벡터 아트, D: pencil 연필",choice,이 이미지에서 나타나는 미술 스타일은 무엇입니까?
1104,math,statistical reasoning,"Given the adjacency matrix of a weighted undirected graph as follows, the total weight of its minimum spanning tree is:<image 1>
 ","A: 22 이십이, B: 20 이십, C: 15 십오, D: 8 팔",choice,"다음과 같은 가중치를 갖는 무향 그래프의 인접 행렬이 주어졌을 때, 그 최소 신장 트리의 총 가중치는 얼마입니까? <image 1>"
86,coarse perception,image scene and topic,"What is the most prominent feature in the image?
 "," A: The skyline 스카이라인, B: The golf course 골프 코스, C: The trees 나무들, D: The person 사람",choice,이미지에서 가장 두드러진 특징은 무엇인가요?
174,coarse perception,image style & quality,"Which category does this image belong to?
 ","A: oil painting 유화, B: sketch 스케치, C: digital art 디지털 아트, D: photo 사진",choice,이 이미지는 어떤 카테고리에 속하나요?
1092,math,numeric commonsense and calculation,"Which operation of fractions is represented by this formula?
 ","A: Add 덧셈, B: Subtract 뺄셈, C: Multiply 곱셈, D: Devide 나눗셈",choice,이 수식이 나타내는 분수의 연산은 무엇입니까?
767,logical reasoning,common reasoning,"In nature, what's the relationship between these two creatures?
 ","A: Predatory relationships 포식 관계, B: Competitive relationships 경쟁 관계, C: Parasitic relationships 기생 관계, D: Symbiotic relationship 공생 관계",choice,자연에서 이 두 생물 사이의 관계는 무엇인가요?
805,logical reasoning,common reasoning,"What will happen next?
 "," A: the person is gonna fall off the ladder 그 사람이 사다리에서 떨어질 거야, B: the person is gonna stand still on the ladder 그 사람은 사다리 위에서 가만히 있을 거야, C: someone is gonna come and hold the ladder 누군가 와서 사다리를 잡아줄 거야, D: both A,B, and C A, B, C 모두",choice,다음에 무슨 일이 일어날까요?
1208,science & technology,biology & chemistry & physics,"In the diagram of the food web shown, what do flat fish eat as food?
 ","A: fan worm 부채벌레, B: nurse shark 간호상어, C: giant clam 거대한 대합조개, D: turtle grass 거북이풀",choice,제시된 먹이망 다이어그램에서 편평한 물고기는 먹이로 무엇을 삼나요?
527,instance reasoning,cross-instance attribute reasoning,"Which picture depicts cell division?
 ","A: B 비, B: A 에이, C: C 씨, D: {}",choice,어떤 그림이 세포 분열을 묘사하고 있습니까?
38,coarse perception,image scene and topic,"What is the color of the majority of objects in the image?
 ","A: White 흰색, B: Gray 회색, C: Blue 파란색, D: Green 초록색",choice,이미지 속 다수의 물체의 색은 무엇입니까?
19,coarse perception,image emotion,"Which mood does this image convey?
 ","A: Sad 슬픈, B: Cozy 아늑한, C: Happy 행복한, D: Angry 화난",choice,이 이미지가 전달하는 분위기는 무엇입니까?
519,instance reasoning,cross-instance attribute reasoning,"Which of the following statements match the image?
 ","A: A triangle is to the left of a pentagon., B: A blue pentagon is to the right of a gray pentagon., C: A blue square is to the left of a blue pentagon., D: A blue pentagon is to the left of a gray shape. A: 삼각형이 오각형의 왼쪽에 있다., B: 파란 오각형이 회색 오각형의 오른쪽에 있다., C: 파란 정사각형이 파란 오각형의 왼쪽에 있다., D: 파란 오각형이 회색 도형의 왼쪽에 있다.",choice,다음 중 이미지와 일치하는 진술은 무엇입니까?
1209,science & technology,biology & chemistry & physics,"In the diagram of the food web shown, what will most directly be impacted if the supply of deer increase?
 ","A: foxes will decrease 여우들이 감소할 것이다, B: fruit trees will decrease 과일나무들이 감소할 것이다, C: fruit trees will increase 과일나무들이 증가할 것이다, D: grass will decrease 풀은 감소할 것이다",choice,제시된 먹이망 다이어그램에서 사슴의 공급량이 증가하면 가장 직접적으로 어떤 것이 영향을 받게 될까요?
246,fine-grained perception,object counting,"How many apples are there in the image? And how many bananas are there?
 ","A: 3 apples and 1 bananas 사과 3개와 바나나 1개, B: 3 apples and 2 bananas 사과 3개와 바나나 2개, C: 1 apples and 1 bananas 사과 1개와 바나나 1개, D: 2 apples and 1 bananas 사과 2개와 바나나 1개",choice,이미지에는 사과가 몇 개 있나요? 그리고 바나나가 몇 개 있나요?
123,coarse perception,image scene and topic,"What kind of weather is depicted in the picture?
 ","A: sunny 맑음, B: rainy 비 오는, C: windy 바람 부는, D: snowy 눈 오는",choice,사진에 묘사된 날씨는 어떤 모습인가요?
56,coarse perception,image scene and topic,"What is the main color of the image?
 "," A: Red 빨간색, B: Green 초록색, C: Black 검은색, D: White 흰색",choice,이미지의 주요 색상은 무엇입니까?
653,instance reasoning,single-instance reasoning,"What's the profession of the people in this picture?
 ","A: mason 석공, B: postman 우편배달원, C: pilot 조종사, D: policeman 경찰관",choice,이 사진 속 사람들의 직업은 무엇입니까?
94,coarse perception,image scene and topic,"What is the overall theme of this image?
 ","A: Sports 스포츠, B: Sunset 일몰, C: Nature 자연, D: Kids playing 아이들이 노는 모습",choice,이 이미지의 전반적인 주제는 무엇인가요?
373,fine-grained perception,recognition,"What is the color of the ball closest to the man?
 ","A: White 흰색, B: Red 빨간색, C: Blue 파란색, D: Brown 갈색",choice,그 남자와 가장 가까운 공의 색은 무엇입니까?
33,coarse perception,image scene and topic,"What color dominates the logo seen on the wall?
 ","A: Red 빨간색, B: Black and White 검은색과 흰색, C: Yellow 노란색, D: Blue 파란색",choice,벽에 보이는 로고의 주된 색상은 무엇입니까?
1181,science & technology,biology & chemistry & physics,"<image 1> What could be the reason for the corky outgrowths on a young ash tree by the roadside in Littondale, Yorkshire?
 ","A: Fungal disease 진균병, B: Bacterial disease 세균성 질병, C: Don't know or not sure 모름 또는 확실하지 않음, D: Genetic abnormality 유전적 이상",choice,"<이미지 1> Littondale, Yorkshire의 도로변에 있는 어린 자작나무에 생긴 코르크 모양의 돌출부의 원인은 무엇일 수 있을까요?"
92,coarse perception,image scene and topic,"What is the overall theme of the image?
 ","A: Beach vacation 해변 휴가, B: Athletic lifestyle 운동적인 생활 방식, C: Summer fashion 여름 패션, D: Urban street style 도시 스트리트 스타일",choice,그 이미지를 전반적으로 나타내는 주제는 무엇입니까?
378,fine-grained perception,recognition,"What is the color of the ears on the dessert item located in the bottom right of the image?
 ","A: Red, B: Brown, C: Black, D: White A: 빨간색, B: 갈색, C: 검정색, D: 흰색",choice,이미지의 오른쪽 아래에 위치한 디저트 아이템의 귀 색은 무엇입니까?
410,fine-grained perception,recognition,"What is the main item on the counter in the image?
 ","A: A cup of ice cream on a counter with a cone on top 위에 콘이 얹힌 카운터 위의 아이스크림 컵, B: Two ice cream cones sitting next to each other 두 개의 아이스크림 콘이 서로 나란히 놓여 있다, C: A coffee cup with whipped cream on top 윗면에 휘핑 크림이 얹힌 커피 잔, D: A cup of ice cream with different flavors 다른 맛의 아이스크림 한 컵",choice,사진 속 카운터에 있는 주요 아이템은 무엇입니까?
814,logical reasoning,common reasoning,"Which corner doesn't have any food?
 ","A: top-right 오른쪽 위, B: top-left 왼쪽 위, C: bottom-left 왼쪽 아래, D: bottom-right 오른쪽 아래",choice,어떤 모서리에는 음식이 없나요?
55,coarse perception,image scene and topic,"What is the main activity happening in this image?
 ",A: A couple of men are playing soccer 남자 두 명이 축구를 하고 있다 B: A group of people are having a picnic in the park 공원에서 사람들이 피크닉을 하고 있다 C: Two men are playing cricket 두 남자들이 크리켓을 하고 있다 D: A group of people are playing volleyball 한 무리의 사람들이 배구를 하고 있다,choice,이 이미지에서 주된 활동은 무엇인가요?
